{"server":"iota","name":"github.com","idnName":"github.com","status":["clientUpdateProhibited (https:\/\/www.icann.org\/epp#clientUpdateProhibited)","clientTransferProhibited (https:\/\/www.icann.org\/epp#clientTransferProhibited)","clientDeleteProhibited (https:\/\/www.icann.org\/epp#clientDeleteProhibited)"],"nameserver":["ns-1707.awsdns-21.co.uk","dns2.p08.nsone.net","dns3.p08.nsone.net","ns-421.awsdns-52.com","ns-1283.awsdns-32.org","ns-520.awsdns-01.net","dns4.p08.nsone.net","dns1.p08.nsone.net"],"ips":"140.82.121.4","created":"2007-10-09 18:20:50","changed":"2022-09-07 09:10:44","expires":"2024-10-09 18:20:50","registered":true,"dnssec":"unsigned","whoisserver":"whois.markmonitor.com","contacts":{"owner":[{"handle":null,"type":null,"name":null,"organization":"GitHub, Inc.","email":"Select Request Email Form at https:\/\/domains.markmonitor.com\/whois\/github.com","address":null,"zipcode":null,"city":null,"state":"CA","country":"US","phone":null,"fax":null,"created":null,"changed":null}],"admin":[{"handle":null,"type":null,"name":null,"organization":"GitHub, Inc.","email":"Select Request Email Form at https:\/\/domains.markmonitor.com\/whois\/github.com","address":null,"zipcode":null,"city":null,"state":"CA","country":"US","phone":null,"fax":null,"created":null,"changed":null}],"tech":[{"handle":null,"type":null,"name":null,"organization":"GitHub, Inc.","email":"Select Request Email Form at https:\/\/domains.markmonitor.com\/whois\/github.com","address":null,"zipcode":null,"city":null,"state":"CA","country":"US","phone":null,"fax":null,"created":null,"changed":null}]},"registrar":{"id":"292","name":"MarkMonitor, Inc.","email":"abusecomplaints@markmonitor.com","url":"http:\/\/www.markmonitor.com","phone":"+1.2083895770"},"rawdata":["   Domain Name: GITHUB.COM\n   Registry Domain ID: 1264983250_DOMAIN_COM-VRSN\n   Registrar WHOIS Server: whois.markmonitor.com\n   Registrar URL: http:\/\/www.markmonitor.com\n   Updated Date: 2022-09-07T09:10:44Z\n   Creation Date: 2007-10-09T18:20:50Z\n   Registry Expiry Date: 2024-10-09T18:20:50Z\n   Registrar: MarkMonitor Inc.\n   Registrar IANA ID: 292\n   Registrar Abuse Contact Email: abusecomplaints@markmonitor.com\n   Registrar Abuse Contact Phone: +1.2086851750\n   Domain Status: clientDeleteProhibited https:\/\/icann.org\/epp#clientDeleteProhibited\n   Domain Status: clientTransferProhibited https:\/\/icann.org\/epp#clientTransferProhibited\n   Domain Status: clientUpdateProhibited https:\/\/icann.org\/epp#clientUpdateProhibited\n   Name Server: DNS1.P08.NSONE.NET\n   Name Server: DNS2.P08.NSONE.NET\n   Name Server: DNS3.P08.NSONE.NET\n   Name Server: DNS4.P08.NSONE.NET\n   Name Server: NS-1283.AWSDNS-32.ORG\n   Name Server: NS-1707.AWSDNS-21.CO.UK\n   Name Server: NS-421.AWSDNS-52.COM\n   Name Server: NS-520.AWSDNS-01.NET\n   DNSSEC: unsigned\n   URL of the ICANN Whois Inaccuracy Complaint Form: https:\/\/www.icann.org\/wicf\/\n>>> Last update of whois database: 2022-11-14T06:03:44Z <<<\n\nFor more information on Whois status codes, please visit https:\/\/icann.org\/epp\n\nNOTICE: The expiration date displayed in this record is the date the\nregistrar's sponsorship of the domain name registration in the registry is\ncurrently set to expire. This date does not necessarily reflect the expiration\ndate of the domain name registrant's agreement with the sponsoring\nregistrar.  Users may consult the sponsoring registrar's Whois database to\nview the registrar's reported date of expiration for this registration.\n\nTERMS OF USE: You are not authorized to access or query our Whois\ndatabase through the use of electronic processes that are high-volume and\nautomated except as reasonably necessary to register domain names or\nmodify existing registrations; the Data in VeriSign Global Registry\nServices' (\"VeriSign\") Whois database is provided by VeriSign for\ninformation purposes only, and to assist persons in obtaining information\nabout or related to a domain name registration record. VeriSign does not\nguarantee its accuracy. By submitting a Whois query, you agree to abide\nby the following terms of use: You agree that you may use this Data only\nfor lawful purposes and that under no circumstances will you use this Data\nto: (1) allow, enable, or otherwise support the transmission of mass\nunsolicited, commercial advertising or solicitations via e-mail, telephone,\nor facsimile; or (2) enable high volume, automated, electronic processes\nthat apply to VeriSign (or its computer systems). The compilation,\nrepackaging, dissemination or other use of this Data is expressly\nprohibited without the prior written consent of VeriSign. You agree not to\nuse electronic processes that are automated and high-volume to access or\nquery the Whois database except as reasonably necessary to register\ndomain names or modify existing registrations. VeriSign reserves the right\nto restrict your access to the Whois database in its sole discretion to ensure\noperational stability.  VeriSign may restrict or terminate your access to the\nWhois database for failure to abide by these terms of use. VeriSign\nreserves the right to modify these terms at any time.\n\nThe Registry database contains ONLY .COM, .NET, .EDU domains and\nRegistrars.\n","Domain Name: github.com\nRegistry Domain ID: 1264983250_DOMAIN_COM-VRSN\nRegistrar WHOIS Server: whois.markmonitor.com\nRegistrar URL: http:\/\/www.markmonitor.com\nUpdated Date: 2022-09-07T09:10:44+0000\nCreation Date: 2007-10-09T18:20:50+0000\nRegistrar Registration Expiration Date: 2024-10-09T00:00:00+0000\nRegistrar: MarkMonitor, Inc.\nRegistrar IANA ID: 292\nRegistrar Abuse Contact Email: abusecomplaints@markmonitor.com\nRegistrar Abuse Contact Phone: +1.2083895770\nDomain Status: clientUpdateProhibited (https:\/\/www.icann.org\/epp#clientUpdateProhibited)\nDomain Status: clientTransferProhibited (https:\/\/www.icann.org\/epp#clientTransferProhibited)\nDomain Status: clientDeleteProhibited (https:\/\/www.icann.org\/epp#clientDeleteProhibited)\nRegistrant Organization: GitHub, Inc.\nRegistrant State\/Province: CA\nRegistrant Country: US\nRegistrant Email: Select Request Email Form at https:\/\/domains.markmonitor.com\/whois\/github.com\nAdmin Organization: GitHub, Inc.\nAdmin State\/Province: CA\nAdmin Country: US\nAdmin Email: Select Request Email Form at https:\/\/domains.markmonitor.com\/whois\/github.com\nTech Organization: GitHub, Inc.\nTech State\/Province: CA\nTech Country: US\nTech Email: Select Request Email Form at https:\/\/domains.markmonitor.com\/whois\/github.com\nName Server: ns-1707.awsdns-21.co.uk\nName Server: dns2.p08.nsone.net\nName Server: dns3.p08.nsone.net\nName Server: ns-421.awsdns-52.com\nName Server: ns-1283.awsdns-32.org\nName Server: ns-520.awsdns-01.net\nName Server: dns4.p08.nsone.net\nName Server: dns1.p08.nsone.net\nDNSSEC: unsigned\nURL of the ICANN WHOIS Data Problem Reporting System: http:\/\/wdprs.internic.net\/\n>>> Last update of WHOIS database: 2022-11-14T06:00:07+0000 <<<\n\nFor more information on WHOIS status codes, please visit:\n  https:\/\/www.icann.org\/resources\/pages\/epp-status-codes\n\nIf you wish to contact this domain\u2019s Registrant, Administrative, or Technical\ncontact, and such email address is not visible above, you may do so via our web\nform, pursuant to ICANN\u2019s Temporary Specification. To verify that you are not a\nrobot, please enter your email address to receive a link to a page that\nfacilitates email communication with the relevant contact(s).\n\nWeb-based WHOIS:\n  https:\/\/domains.markmonitor.com\/whois\n\nIf you have a legitimate interest in viewing the non-public WHOIS details, send\nyour request and the reasons for your request to whoisrequest@markmonitor.com\nand specify the domain name in the subject line. We will review that request and\nmay ask for supporting documentation and explanation.\n\nThe data in MarkMonitor\u2019s WHOIS database is provided for information purposes,\nand to assist persons in obtaining information about or related to a domain\nname\u2019s registration record. While MarkMonitor believes the data to be accurate,\nthe data is provided \"as is\" with no guarantee or warranties regarding its\naccuracy.\n\nBy submitting a WHOIS query, you agree that you will use this data only for\nlawful purposes and that, under no circumstances will you use this data to:\n  (1) allow, enable, or otherwise support the transmission by email, telephone,\nor facsimile of mass, unsolicited, commercial advertising, or spam; or\n  (2) enable high volume, automated, or electronic processes that send queries,\ndata, or email to MarkMonitor (or its systems) or the domain name contacts (or\nits systems).\n\nMarkMonitor reserves the right to modify these terms at any time.\n\nBy submitting this query, you agree to abide by this policy.\n\nMarkMonitor Domain Management(TM)\nProtecting companies and consumers in a digital world.\n\nVisit MarkMonitor at https:\/\/www.markmonitor.com\nContact us at +1.8007459229\nIn Europe, at +44.02032062220\n--\n"],"network":null,"exception":null,"parsedContacts":true,"template":{"whois.verisign-grs.com":"verisign","whois.markmonitor.com":"standard"},"ask_whois":"whois.markmonitor.com"}
